{"completed_at":"2026-07-23T00:40:00+08:00","entries":[{"cannot_prove":["不能证明协作网络变化等于组织信任下降","不能证明所有远程形式、组织和时间窗都会出现同一结果","不能提供当前组织的现实授权"],"claim_ids":["CLAIM-REMOTE-TRUST-UNIVERSAL"],"claim_relation":"contextual","direction":"support","finding":"61,182 名信息工作者的研究发现远程阶段协作网络更静态、更孤岛化、桥接减少且异步沟通增加，为媒介收缩与弱联系损失机制提供情境支持。","query":"remote work collaboration networks weak ties causal evidence Microsoft employees","retrieval_id":"RETRIEVAL-SUPPORT-COLLABORATION","retrieved_at":"2026-07-23T00:32:00+08:00","round":1,"sources":[{"duplicate_of_url":null,"duplicate_relation":"independent","event_date":"2020-01-01","independence_group":"INDEPENDENCE-YANG-MICROSOFT-2021","interest_relevance":"作者研究 Microsoft 员工数字协作网络；结果与远程协作机制相关，但研究组织与当前未知对象不同。","published_at":"2021-09-09","publisher":"Nature Human Behaviour","source_type":"research","title":"The effects of remote work on collaboration among information workers","url":"https://www.nature.com/articles/s41562-021-01196-4"}],"stop_reason":"已取得可回查的机制研究，继续同源检索不会增加独立性。","tool":"web.search_query+open"},{"cannot_prove":["学生团队不能直接代表所有组织岗位","不能证明远程办公通常无害","不能识别当前组织的反馈制度"],"claim_ids":["CLAIM-REMOTE-TRUST-UNIVERSAL"],"claim_relation":"refutes","direction":"reverse","finding":"纵向虚拟团队研究报告初始信任大体稳定，信任下降与负面反馈相关；这直接反驳“虚拟或远程形态本身必然摧毁信任”。","query":"virtual teams longitudinal trust initial trust stable performance feedback study","retrieval_id":"RETRIEVAL-REVERSE-TRUST-STABILITY","retrieved_at":"2026-07-23T00:33:00+08:00","round":1,"sources":[{"duplicate_of_url":null,"duplicate_relation":"independent","event_date":"2018-11-06","independence_group":"INDEPENDENCE-VIRTUAL-TRUST-2018","interest_relevance":"研究 71 个虚拟学生团队的纵向信任；样本与企业组织不同，但直接检验虚拟团队信任的稳定与变化。","published_at":"2018-11-06","publisher":"Team Performance Management / ScienceDirect","source_type":"research","title":"The space between – linking trust with individual and team performance in virtual teams","url":"https://www.sciencedirect.com/science/article/pii/S135275921800026X"}],"stop_reason":"已取得直接信任反向证据，结论仅用于反驳全称量词。","tool":"web.search_query+open"},{"cannot_prove":["元分析异质性不能替代当前组织对象冻结","不能把团队功能结果无映射地等同组织信任","不能据此选择现实方案"],"claim_ids":["CLAIM-REMOTE-TRUST-UNIVERSAL"],"claim_relation":"refutes","direction":"failure","finding":"80 项研究的元分析指出虚拟性的负面效应不能普遍化，并在长期团队中减弱或消失，显示把办公媒介直接写成单向阶段模型会失效。","query":"virtualness team performance meta analysis long term teams negative effects generalizable","retrieval_id":"RETRIEVAL-FAILURE-META","retrieved_at":"2026-07-23T00:34:00+08:00","round":1,"sources":[{"duplicate_of_url":null,"duplicate_relation":"independent","event_date":"2012-10-01","independence_group":"INDEPENDENCE-VIRTUALNESS-META-2012","interest_relevance":"汇总 80 项研究并检验虚拟性效应边界；与信任命题相关但结果域不限于信任。","published_at":"2012-10-01","publisher":"Information & Management / ScienceDirect","source_type":"research","title":"A meta-analysis of the consequences of virtualness on team functioning","url":"https://www.sciencedirect.com/science/article/abs/pii/S0378720612000626"}],"stop_reason":"已获得覆盖多研究的失效边界，后续转向竞争机制与受影响位置。","tool":"web.search_query+open"},{"cannot_prove":["访谈不能给出普遍因果概率","疫情居家办公不能等同自愿混合办公","不能证明当前组织具体机制"],"claim_ids":["CLAIM-REMOTE-TRUST-UNIVERSAL"],"claim_relation":"alternative_mechanism","direction":"alternative_mechanism","finding":"访谈研究同时发现信任破坏与维持因素，支持治理、沟通和情境条件作为替代机制，而不是把远程地点视为充分原因。","query":"trust disruption preservation work from home interviews mechanisms","retrieval_id":"RETRIEVAL-ALTERNATIVE-TRUST-PRESERVATION","retrieved_at":"2026-07-23T00:35:00+08:00","round":1,"sources":[{"duplicate_of_url":null,"duplicate_relation":"independent","event_date":"2020-11-01","independence_group":"INDEPENDENCE-WFH-TRUST-2022","interest_relevance":"访谈材料同时识别居家办公中的信任破坏与维持因素；情境受疫情冲击影响。","published_at":"2022-08-19","publisher":"Information Technology & People / ScienceDirect","source_type":"research","title":"Trust disruption and preservation in the Covid-19 work from home context","url":"https://www.sciencedirect.com/org/science/article/pii/S1366562622000067"}],"stop_reason":"已取得同时包含破坏与维持路径的独立替代机制来源。","tool":"web.search_query+open"},{"cannot_prove":["反馈和职业结果不能直接等同组织信任","不能断言所有新人都受损","不能授权监测个人网络"],"claim_ids":["CLAIM-REMOTE-TRUST-UNIVERSAL"],"claim_relation":"affected_position","direction":"affected_or_low_power","finding":"研究显示接近同事带来的反馈利益对年轻或资历较浅员工更重要，提示新人位置不能被组织平均值删除，成本可能在成员间重分配。","query":"remote work proximity feedback younger less tenured employees study","retrieval_id":"RETRIEVAL-AFFECTED-PROXIMITY","retrieved_at":"2026-07-23T00:35:30+08:00","round":1,"sources":[{"duplicate_of_url":null,"duplicate_relation":"independent","event_date":"2020-03-06","independence_group":"INDEPENDENCE-NBER-PROXIMITY-2023","interest_relevance":"研究同事接近度、反馈与职业结果，突出年轻和资历较浅员工的差异位置；并非直接信任测量。","published_at":"2023-11-01","publisher":"National Bureau of Economic Research","source_type":"research","title":"The Power of Proximity to Coworkers","url":"https://www.nber.org/system/files/working_papers/w31880/w31880.pdf"}],"stop_reason":"低权力与新人位置已由独立研究显式覆盖。","tool":"web.search_query+open"},{"cannot_prove":["通信边不等于组织信任","无法给出当前组织路径概率","不能改变现实授权上限"],"claim_ids":["CLAIM-REMOTE-TRUST-UNIVERSAL"],"claim_relation":"alternative_mechanism","direction":"alternative_mechanism","finding":"共址丧失伴随超过 4,800 条弱联系消失，而混合安排下部分关系再生；该结果细化弱联系机制，但不改变对全称命题的 rejects、moderate 判断或低信息排序。","query":"co-location communication networks weak ties loss hybrid work regeneration study","retrieval_id":"RETRIEVAL-SATURATION-WEAK-TIES","retrieved_at":"2026-07-23T00:36:00+08:00","round":2,"sources":[{"duplicate_of_url":null,"duplicate_relation":"independent","event_date":"2020-03-01","independence_group":"INDEPENDENCE-COLOCATION-NETWORK-2022","interest_relevance":"研究共址变化与通信网络，提供弱联系损失及混合条件下部分再生的网络证据；不直接测量信任。","published_at":"2022-08-22","publisher":"Nature Computational Science","source_type":"research","title":"The effect of co-location on human communication networks","url":"https://www.nature.com/articles/s43588-022-00296-z"}],"stop_reason":"本轮没有改变 claim、概念状态、判断强度、路径排序、行动上限或阻断性反例；只增加了与既有弱联系机制一致的细节。","tool":"web.search_query+open"},{"cannot_prove":["绩效与留任不能直接证明信任未变","混合办公不能代表长期全远程","不能改变当前六方案的个案排序"],"claim_ids":["CLAIM-REMOTE-TRUST-UNIVERSAL"],"claim_relation":"contextual","direction":"reverse","finding":"随机混合办公试验改善留任且未损害绩效，并呈现子群差异；它继续限制“远程必然造成组织破坏”的外推，但不提供当前组织的选择性事实。","query":"randomized hybrid work trial retention performance Nature 2024","retrieval_id":"RETRIEVAL-SATURATION-HYBRID","retrieved_at":"2026-07-23T00:39:00+08:00","round":3,"sources":[{"duplicate_of_url":null,"duplicate_relation":"independent","event_date":"2021-08-09","independence_group":"INDEPENDENCE-HYBRID-RCT-2024","interest_relevance":"1,612 名员工的随机混合办公试验检验留任与绩效；组织与结果域均不能直接代表当前组织信任。","published_at":"2024-06-12","publisher":"Nature","source_type":"research","title":"Hybrid working from home improves retention without damaging performance","url":"https://www.nature.com/articles/s41586-024-07500-2"}],"stop_reason":"第二个连续实际检索轮仍未改变 claim、概念状态、判断强度、路径排序、行动上限或阻断性反例，故在冻结截止点停止。","tool":"web.search_query+open"}],"network_available":true,"run_id":"promax-green-v3-gpt-5-6-sol-a1-f2bde4ebcefa435fbf4be12cf278730b","saturation_rounds":[{"changed_claim_ids":["CLAIM-REMOTE-TRUST-UNIVERSAL"],"round":1,"stop_reason":"五向检索建立了支持、反向、失效、替代机制与低权力位置闭包，判断由未定收敛为 rejects、moderate。","substantive_novelty":true},{"changed_claim_ids":[],"round":2,"stop_reason":"实际查询只补充弱联系可逆细节，对 claim、概念状态、判断强度、路径排序、行动上限和阻断性反例均无实质新增。","substantive_novelty":false},{"changed_claim_ids":[],"round":3,"stop_reason":"实际随机试验查询继续限制全称外推，对 claim、概念状态、判断强度、路径排序、行动上限和阻断性反例均无实质新增，达到连续两轮零新颖度。","substantive_novelty":false}],"schema_id":"crossframe.promax.v8.retrieval-ledger","schema_version":1,"source_snapshot_sha256":"3186805a3e46e1b16948a4e51d08e7693a8e0dd04aa6b4604e796266d649936c"}
