{"completed_at":"2026-07-23T08:50:00+08:00","entries":[{"cannot_prove":["不能证明任何组织都会失去信任。","不能把疫情锁定期的团队沟通结果直接等同于组织信任。"],"claim_ids":["CLAIM-REMOTE-TRUST-INEVITABILITY"],"claim_relation":"contextual","direction":"support","finding":"该研究讨论强制居家安排下团队沟通的变化，并指出团队构成、任务结构和熟悉度会调节结果；它支持存在关系摩擦路径这一可能性。","query":"remote work team communication trust conditional effects study","retrieval_id":"RETRIEVAL-SUPPORT-1","retrieved_at":"2026-07-23T08:45:00+08:00","round":1,"sources":[{"duplicate_of_url":null,"duplicate_relation":"independent","event_date":"2020-05-01","independence_group":"sage-team-communication","interest_relevance":"用于检验远程工作、沟通和信任之间的条件关系；不把单一来源当作组织个案事实。","published_at":"2022-06-01","publisher":"German Journal of Human Resource Management / Sage","source_type":"research","title":"Forced to go virtual. Working-from-home arrangements and their effect on team communication during COVID-19 lockdown","url":"https://journals.sagepub.com/doi/pdf/10.1177/23970022221083698"}],"stop_reason":"已获得一条支持条件路径而非普遍因果的研究来源。","tool":"web.search"},{"cannot_prove":["不能证明所有组织的远程安排都会提升信任。","不能证明同事或主管层面的信任没有条件差异。"],"claim_ids":["CLAIM-REMOTE-TRUST-INEVITABILITY"],"claim_relation":"refutes","direction":"reverse","finding":"该纵向研究报告更多远程工时与对组织的信任并非必然下降，因而直接反驳“必然摧毁”的全称表述。","query":"does remote work erode trust in organizations within person investigation","retrieval_id":"RETRIEVAL-REVERSE-1","retrieved_at":"2026-07-23T08:46:00+08:00","round":1,"sources":[{"duplicate_of_url":null,"duplicate_relation":"independent","event_date":"2020-05-01","independence_group":"tue-trust-longitudinal","interest_relevance":"用于检验远程工作、沟通和信任之间的条件关系；不把单一来源当作组织个案事实。","published_at":"2023-07-01","publisher":"Eindhoven University of Technology","source_type":"research","title":"Does remote work erode trust in organizations? A within-person investigation in the COVID-19 context","url":"https://research.tue.nl/en/publications/does-remote-work-erode-trust-in-organizations-a-within-person-inv/"}],"stop_reason":"已有与全称命题相冲突的独立证据，继续检索转向边界与失败条件。","tool":"web.search"},{"cannot_prove":["不能以留任或绩效代替信任。","不能把一个中国技术企业的试验推广为所有组织。"],"claim_ids":["CLAIM-REMOTE-TRUST-INEVITABILITY"],"claim_relation":"mixed","direction":"failure","finding":"随机试验报告混合办公改善留任且未损害绩效，说明地点安排的后果不能被压缩为单向必然崩塌；同时它并未直接测量组织信任。","query":"hybrid working retention performance randomized trial remote work","retrieval_id":"RETRIEVAL-FAILURE-1","retrieved_at":"2026-07-23T08:47:00+08:00","round":1,"sources":[{"duplicate_of_url":null,"duplicate_relation":"independent","event_date":"2021-01-01","independence_group":"nature-hybrid-trial","interest_relevance":"用于检验远程工作、沟通和信任之间的条件关系；不把单一来源当作组织个案事实。","published_at":"2024-06-12","publisher":"Nature","source_type":"research","title":"Hybrid working from home improves retention without damaging performance","url":"https://www.nature.com/articles/s41586-024-07500-2"}],"stop_reason":"失败检验显示单一地点解释不足，保留组织内测量需要。","tool":"web.search"},{"cannot_prove":["不能证明正式组织的长期信任会由同一机制决定。","不能忽略新人和岗位差异。"],"claim_ids":["CLAIM-REMOTE-TRUST-INEVITABILITY"],"claim_relation":"alternative_mechanism","direction":"alternative_mechanism","finding":"虚拟团队研究把沟通过程与信任、绩效并置，提示治理与沟通接口是可竞争的机制，而非地点的唯一作用。","query":"virtual teams trust performance communication process study","retrieval_id":"RETRIEVAL-ALTERNATIVE-1","retrieved_at":"2026-07-23T08:48:00+08:00","round":1,"sources":[{"duplicate_of_url":null,"duplicate_relation":"independent","event_date":"2010-10-01","independence_group":"oup-virtual-team","interest_relevance":"用于检验远程工作、沟通和信任之间的条件关系；不把单一来源当作组织个案事实。","published_at":"2010-10-01","publisher":"Journal of Computer-Mediated Communication / Oxford Academic","source_type":"research","title":"Trust, Performance, and the Communication Process in Ad Hoc Decision-Making Virtual Teams","url":"https://academic.oup.com/jcmc/article/16/1/27/4067630"}],"stop_reason":"已识别可与地点路径竞争的沟通机制。","tool":"web.search"},{"cannot_prove":["不能证明每位新人都会失去信任。","不能说明挑战只能由地点安排造成。"],"claim_ids":["CLAIM-REMOTE-TRUST-INEVITABILITY"],"claim_relation":"affected_position","direction":"affected_or_low_power","finding":"关于远程社会化的研究提示新人接入与关系学习可能遇到额外挑战，因此低权力和新成员位置需要被单独观察。","query":"remote employee socialization newcomer challenges study","retrieval_id":"RETRIEVAL-AFFECTED-1","retrieved_at":"2026-07-23T08:49:00+08:00","round":1,"sources":[{"duplicate_of_url":null,"duplicate_relation":"independent","event_date":"2024-05-01","independence_group":"sage-remote-socialization","interest_relevance":"用于检验远程工作、沟通和信任之间的条件关系；不把单一来源当作组织个案事实。","published_at":"2024-05-01","publisher":"Management Communication Quarterly / Sage","source_type":"research","title":"Remote work and employee socialization","url":"https://journals.sagepub.com/doi/10.1177/08933189241259163"}],"stop_reason":"已将受影响位置纳入路径与保护条件，而未把风险写成既成损害。","tool":"web.search"},{"cannot_prove":["不能把概念框架当作具体组织的因果估计。","不能确认任何特定安排必然摧毁或必然改善信任。"],"claim_ids":["CLAIM-REMOTE-TRUST-INEVITABILITY"],"claim_relation":"alternative_mechanism","direction":"alternative_mechanism","finding":"该文献综述把远程与虚拟团队的信任放在基础、组织和个人要素中讨论，未提供能把地点本身单独确定为必然毁损原因的新证据。","query":"framework building maintaining trust remote virtual teams literature review","retrieval_id":"RETRIEVAL-SATURATION-2","retrieved_at":"2026-07-23T08:51:00+08:00","round":2,"sources":[{"duplicate_of_url":null,"duplicate_relation":"independent","event_date":"2020-10-01","independence_group":"f1000-remote-trust-framework","interest_relevance":"用于检验远程工作、沟通和信任之间的条件关系；不把单一来源当作组织个案事实。","published_at":"2020-10-01","publisher":"F1000Research","source_type":"research","title":"A framework for building and maintain trust in remote and virtual teams","url":"https://f1000research.com/articles/9-1187"}],"stop_reason":"第二轮增加的框架来源未改变中心命题的机制边界，登记为零实质新增。","tool":"web.search"},{"cannot_prove":["不能证明组织层面的信任必然被摧毁。","不能把疫情时期的中介路径无条件推广到所有远程安排。"],"claim_ids":["CLAIM-REMOTE-TRUST-INEVITABILITY"],"claim_relation":"contextual","direction":"support","finding":"该研究考察远程工作者的工作场所孤立如何经由沟通频率与质量影响对主管和同事的信任，仍是需要条件与中介记录的路径而非全称结论。","query":"workplace isolation remote workers communication frequency quality trust supervisors coworkers","retrieval_id":"RETRIEVAL-SATURATION-3","retrieved_at":"2026-07-23T08:52:00+08:00","round":3,"sources":[{"duplicate_of_url":null,"duplicate_relation":"independent","event_date":"2020-05-01","independence_group":"lut-isolation-trust","interest_relevance":"用于检验远程工作、沟通和信任之间的条件关系；不把单一来源当作组织个案事实。","published_at":"2022-01-01","publisher":"LUT University","source_type":"research","title":"Out of sight – Out of trust? An analysis of the mediating role of communication frequency and quality in the relationship between workplace isolation and trust","url":"https://research.lut.fi/converis/portal/detail/Publication/22945867"}],"stop_reason":"第三轮补充的中介路径没有改变已登记的关系接触与治理竞争机制，登记为零实质新增。","tool":"web.search"}],"network_available":true,"run_id":"promax-run-dd7c57f21d368fd0","saturation_rounds":[{"changed_claim_ids":["CLAIM-REMOTE-TRUST-INEVITABILITY"],"round":1,"stop_reason":"五个方向均得到可追溯检索，形成竞争机制与边界。","substantive_novelty":true},{"changed_claim_ids":[],"round":2,"stop_reason":"继续按相同五方向检索未产生能改变中心命题边界的新证据。","substantive_novelty":false},{"changed_claim_ids":[],"round":3,"stop_reason":"第二轮无实质新增，停止把一般研究累积为个案结论。","substantive_novelty":false}],"schema_id":"crossframe.promax.v8.retrieval-ledger","schema_version":1,"source_snapshot_sha256":"3186805a3e46e1b16948a4e51d08e7693a8e0dd04aa6b4604e796266d649936c"}
