{"completed_at":"2026-07-23T08:52:00Z","entries":[{"cannot_prove":["不能证明因果方向","不能外推到疫情以外、所有组织或全远程制度","不能证明远程办公绝不会损害信任"],"claim_ids":["CLAIM-A2-CENTRAL"],"claim_relation":"mixed","direction":"support","finding":"同一个人远程工时占比增加与组织信任上升相关，对同事和主管信任没有显著关系；该结果直接反驳“必然摧毁”，但不证明普遍无害。","query":"Does remote work erode trust in organizations within-person longitudinal findings","retrieval_id":"RETRIEVAL-A2-01","retrieved_at":"2026-07-23T08:40:00Z","round":1,"sources":[{"duplicate_of_url":null,"duplicate_relation":"independent","event_date":"2020-05-01","independence_group":"STAVROVA-2023","interest_relevance":"四波英国远程工作者纵向调查；作者披露机构背景，研究直接测量组织、主管和同事信任。","published_at":"2023-07-01","publisher":"Social and Personality Psychology Compass / Wiley","source_type":"research","title":"Does remote work erode trust in organizations? A within-person investigation in the COVID-19 context","url":"https://compass.onlinelibrary.wiley.com/doi/10.1111/spc3.12762"}],"stop_reason":"支持方向已经获得直接测量组织信任的可核验研究，转入反向与机制检索。","tool":"web.run search/open"},{"cannot_prove":["不能把协作拓扑等同于组织信任","不能外推到混合、自愿或治理不同的安排","不能证明每个员工或团队都受损"],"claim_ids":["CLAIM-A2-CENTRAL"],"claim_relation":"mixed","direction":"reverse","finding":"企业全员远程使协作网络更静态、更孤岛化，并减少同步沟通；这是信任可能受损的候选通道，但研究没有直接测量组织信任。","query":"firm-wide remote work collaboration network silo natural experiment Microsoft","retrieval_id":"RETRIEVAL-A2-02","retrieved_at":"2026-07-23T08:41:00Z","round":1,"sources":[{"duplicate_of_url":null,"duplicate_relation":"independent","event_date":"2020-03-01","independence_group":"MICROSOFT-COLLAB-2021","interest_relevance":"微软参与作者使用 61,182 名员工通信元数据；企业与作者利益关联意味着外推和指标解释需审慎。","published_at":"2021-09-09","publisher":"Nature Human Behaviour","source_type":"research","title":"The effects of remote work on collaboration among information workers","url":"https://www.nature.com/articles/s41562-021-01196-4"}],"stop_reason":"反向方向已定位高质量自然实验及其结果变量边界，继续检索失效例和替代机制。","tool":"web.run search/open"},{"cannot_prove":["不能证明创意变化会转化为信任变化","不能代表长期组织安排","不能比较所有异步和混合沟通设计"],"claim_ids":["CLAIM-A2-CENTRAL"],"claim_relation":"contextual","direction":"failure","finding":"视频沟通降低创意生成但未降低创意选择能力，显示同一媒介对不同任务结果方向不同；把单一结果推广为组织信任整体必然崩坏会失效。","query":"virtual communication field experiment creative idea generation failure condition","retrieval_id":"RETRIEVAL-A2-03","retrieved_at":"2026-07-23T08:42:00Z","round":1,"sources":[{"duplicate_of_url":null,"duplicate_relation":"independent","event_date":"2021-01-01","independence_group":"BRUCKS-LEVAV-2022","interest_relevance":"实验直接比较视频与面对面协作；结果是创意生成而非信任，适合作为办公形式无条件外推的失效边界。","published_at":"2022-04-27","publisher":"Nature","source_type":"research","title":"Virtual communication curbs creative idea generation","url":"https://www.nature.com/articles/s41586-022-04643-y"}],"stop_reason":"失效方向已取得结果变量分化的实验材料，足以约束总体化叙事。","tool":"web.run search/open"},{"cannot_prove":["不能排除反向因果或共同冲击","不能证明提升沟通质量必然修复信任","不能把人际信任直接替代组织信任"],"claim_ids":["CLAIM-A2-CENTRAL"],"claim_relation":"alternative_mechanism","direction":"alternative_mechanism","finding":"隔离与人际信任的负向关系主要由沟通质量和信息共享质量中介，频率作用较弱；候选原因因此是治理与沟通条件，而非地点的单一必然效应。","query":"workplace isolation trust communication quality remote workers mediation","retrieval_id":"RETRIEVAL-A2-04","retrieved_at":"2026-07-23T08:43:00Z","round":1,"sources":[{"duplicate_of_url":null,"duplicate_relation":"independent","event_date":"2020-03-01","independence_group":"VAN-ZOONEN-2024","interest_relevance":"研究把隔离、沟通质量与主管/同事信任分开；检索页是书目信息与摘要，未替代全文方法审计。","published_at":"2024-08-01","publisher":"European Management Journal / RePEc record","source_type":"research","title":"Out of sight – Out of trust? The mediating role of communication frequency and quality","url":"https://ideas.repec.org/a/eee/eurman/v42y2024i4p515-526.html"}],"stop_reason":"替代机制方向已获得能区分地点与沟通质量的研究线索。","tool":"web.run search/open"},{"cannot_prove":["不能代表正式员工或长期信任","不能证明所有新人从同一干预受益","不能用平均效果取消低权力位置的拒绝与申诉"],"claim_ids":["CLAIM-A2-CENTRAL"],"claim_relation":"affected_position","direction":"affected_or_low_power","finding":"特定的定期资深经理虚拟互动在部分条件下改善新人结果，而多种其他虚拟互动没有效果；新人位置既有支持机会也有时间约束。","query":"remote newcomers virtual water coolers randomized field experiment performance socialization","retrieval_id":"RETRIEVAL-A2-05","retrieved_at":"2026-07-23T08:44:00Z","round":1,"sources":[{"duplicate_of_url":null,"duplicate_relation":"independent","event_date":"2021-06-01","independence_group":"VIRTUAL-WATER-COOLERS-2023","interest_relevance":"随机现场实验聚焦远程实习生这一低任期位置；工作论文尚需注意版本与外推边界。","published_at":"2023-02-17","publisher":"Harvard Business School working paper / SSRN","source_type":"research","title":"Virtual Water Coolers: A Field Experiment on the Role of Virtual Interactions on Organizational Newcomer Performance","url":"https://papers.ssrn.com/sol3/papers.cfm?abstract_id=3855788"}],"stop_reason":"受影响位置方向已覆盖新人及干预异质性，进入饱和复核。","tool":"web.run search/open"},{"cannot_prove":["不能证明组织信任上升","不能代表全远程或其他行业","不能改变当前六方案的个案排序"],"claim_ids":["CLAIM-A2-CENTRAL"],"claim_relation":"contextual","direction":"support","finding":"每周两天居家工作的随机试验降低离职并提高满意度，未损害绩效；它再次显示办公形式并非单向决定组织结果，但没有新增个案信任证据。","query":"randomized hybrid working from home retention performance Trip.com Nature 2024","retrieval_id":"RETRIEVAL-A2-06","retrieved_at":"2026-07-23T08:45:00Z","round":2,"sources":[{"duplicate_of_url":null,"duplicate_relation":"independent","event_date":"2021-07-01","independence_group":"TRIP-HYBRID-2024","interest_relevance":"Trip.com 随机试验覆盖工程、营销和财务员工；企业单点、混合安排且信任并非主结果。","published_at":"2024-06-12","publisher":"Nature","source_type":"research","title":"Hybrid working from home improves retention without damaging performance","url":"https://doi.org/10.1038/s41586-024-07500-2"}],"stop_reason":"第二轮没有改变中心判断，只加强了异质性与混合安排边界。","tool":"web.run search/open"},{"cannot_prove":["不能把呼叫中心结果外推到所有知识工作","不能把绩效和晋升结果等同于信任","不能改变低信息方案排序"],"claim_ids":["CLAIM-A2-CENTRAL"],"claim_relation":"contextual","direction":"reverse","finding":"远程处理在该呼叫中心语境下伴随生产率、质量或晋升方面的负面效应及选择差异；这保留风险方向，但仍未提供组织信任的普遍必然效应。","query":"American Economic Journal Applied Economics working remotely productivity promotion call center 2024","retrieval_id":"RETRIEVAL-A2-07","retrieved_at":"2026-07-23T08:46:00Z","round":3,"sources":[{"duplicate_of_url":null,"duplicate_relation":"independent","event_date":"2020-03-01","independence_group":"EMANUEL-HARRINGTON-2024","interest_relevance":"单一大型企业呼叫中心研究区分选择与处理效应；结果是生产率、质量和晋升而非直接信任。","published_at":"2024-10-01","publisher":"American Economic Journal: Applied Economics","source_type":"research","title":"Working Remotely? Selection, Treatment, and the Market for Remote Work","url":"https://pubs.aeaweb.org/doi/abs/10.1257/app.20230376"}],"stop_reason":"第三轮仍未出现改变中心判断或个案选择的新信息，达到连续两轮零实质新颖性。","tool":"web.run search/open"}],"network_available":true,"run_id":"promax-green-v4-gpt-5-6-sol-a2-9742973771c64e89813a768c7894faa8","saturation_rounds":[{"changed_claim_ids":["CLAIM-A2-CENTRAL"],"round":1,"stop_reason":"五个方向首次形成闭合，中心判断由未决收敛为中度拒绝绝对命题。","substantive_novelty":true},{"changed_claim_ids":[],"round":2,"stop_reason":"新增混合办公随机试验只重复条件异质性，没有改变中心判断。","substantive_novelty":false},{"changed_claim_ids":[],"round":3,"stop_reason":"新增岗位特定风险研究没有直接信任结果，也不改变判断或方案排序。","substantive_novelty":false}],"schema_id":"crossframe.promax.v8.retrieval-ledger","schema_version":1,"source_snapshot_sha256":"3186805a3e46e1b16948a4e51d08e7693a8e0dd04aa6b4604e796266d649936c"}
